# name: test/sql/attach_delete.test
# description: Test DELETE
# group: [sql]

require mysql_scanner

require-env MYSQL_TEST_DATABASE_AVAILABLE

statement ok
ATTACH 'host=localhost user=root port=0 database=mysqlscanner' AS s1 (TYPE MYSQL_SCANNER)

statement ok
CREATE OR REPLACE TABLE s1.test(i INTEGER);

statement ok
INSERT INTO s1.test VALUES (1), (2), (3), (NULL);

# TODO: number of rows

# simple delete
statement ok
DELETE FROM s1.test WHERE i=2

query I
SELECT * FROM s1.test
----
1
3
NULL

# no matches
statement ok
DELETE FROM s1.test WHERE i=999

# expressions are pushed into MySQL directly so we can only use MySQL functions
statement error
DELETE FROM s1.test WHERE date '1992-01-01' + interval (i) days > date '1992-02-01'
----
DELETE syntax not supported

query I
SELECT * FROM s1.test
----
1
3
NULL

# delete without parameters
statement ok
DELETE FROM s1.test

query I
SELECT * FROM s1.test

statement ok
DELETE FROM s1.test

# RETURNING statement
statement error
DELETE FROM s1.test RETURNING *;
----
DELETE syntax not supported

statement ok
INSERT INTO s1.test VALUES (1), (2), (3), (NULL);

statement ok
CREATE TABLE duckdb_table AS SELECT 1 i UNION ALL SELECT 3 UNION ALL SELECT 1

# DELETE with join on another table
statement error
DELETE FROM s1.test USING duckdb_table WHERE test.i = duckdb_table.i
----
DELETE syntax not supported

# fails on MySQL
statement maybe
DELETE FROM s1.test WHERE i=(SELECT MIN(i) FROM s1.test)
----
PREPARE error

